{
  "authority": {
    "decision_authority": "human-only",
    "notice": "Recommendations document training and codebook proposals only. They do not alter accepted annotations or adjudicate queue items.",
    "retroactive_change_permitted": false
  },
  "case_id": "lincoln",
  "generator": "scripts/model_reliability/generate_codebook_notes.py",
  "recommendations": [
    {
      "case_id": "lincoln",
      "categories": [
        "cluster-instability"
      ],
      "decided_at": null,
      "decision_rationale": "Awaiting explicit human review.",
      "decision_source": "generated-default",
      "disagreement_ids": [
        "disagreement-0001",
        "disagreement-0024",
        "disagreement-0047",
        "disagreement-0069",
        "disagreement-0092",
        "disagreement-0115",
        "disagreement-0138"
      ],
      "disposition": "deferred",
      "evidence_count": 7,
      "field": "cmt.cluster_id",
      "finding_type": "ambiguous-instruction",
      "observation": "7 queued `cluster-instability` item(s) affect `cmt.cluster_id` in `en`.",
      "queue_ids": [
        "review-0033",
        "review-0040",
        "review-0047",
        "review-0098",
        "review-0105",
        "review-0112",
        "review-0119"
      ],
      "recommendation_id": "codebook-rec-253e11b755e1",
      "recommended_change": "Clarify domain and cluster distinctions with contrastive mapping examples.",
      "reviewer": null,
      "source_language": "en",
      "task_layer": "cmt",
      "training_use": "Use the reviewed examples as a contrastive calibration set; retain source language and uncertainty notes."
    },
    {
      "case_id": "lincoln",
      "categories": [
        "semantic-instability"
      ],
      "decided_at": null,
      "decision_rationale": "Awaiting explicit human review.",
      "decision_source": "generated-default",
      "disagreement_ids": [
        "disagreement-0002",
        "disagreement-0025",
        "disagreement-0048",
        "disagreement-0070",
        "disagreement-0093",
        "disagreement-0116",
        "disagreement-0139"
      ],
      "disposition": "deferred",
      "evidence_count": 7,
      "field": "cmt.conceptual_metaphor",
      "finding_type": "ambiguous-instruction",
      "observation": "7 queued `semantic-instability` item(s) affect `cmt.conceptual_metaphor` in `en`.",
      "queue_ids": [
        "review-0129",
        "review-0132",
        "review-0135",
        "review-0142",
        "review-0145",
        "review-0148",
        "review-0151"
      ],
      "recommendation_id": "codebook-rec-1c1d7d367726",
      "recommended_change": "Clarify the decision rule for `cmt.conceptual_metaphor` with contrastive examples.",
      "reviewer": null,
      "source_language": "en",
      "task_layer": "cmt",
      "training_use": "Use the reviewed examples as a contrastive calibration set; retain source language and uncertainty notes."
    },
    {
      "case_id": "lincoln",
      "categories": [
        "semantic-instability"
      ],
      "decided_at": null,
      "decision_rationale": "Awaiting explicit human review.",
      "decision_source": "generated-default",
      "disagreement_ids": [
        "disagreement-0003",
        "disagreement-0026",
        "disagreement-0049",
        "disagreement-0071",
        "disagreement-0094",
        "disagreement-0117",
        "disagreement-0140"
      ],
      "disposition": "deferred",
      "evidence_count": 7,
      "field": "cmt.entailments",
      "finding_type": "ambiguous-instruction",
      "observation": "7 queued `semantic-instability` item(s) affect `cmt.entailments` in `en`.",
      "queue_ids": [
        "review-0130",
        "review-0133",
        "review-0136",
        "review-0143",
        "review-0146",
        "review-0149",
        "review-0152"
      ],
      "recommendation_id": "codebook-rec-44d3f615fe5e",
      "recommended_change": "Clarify the decision rule for `cmt.entailments` with contrastive examples.",
      "reviewer": null,
      "source_language": "en",
      "task_layer": "cmt",
      "training_use": "Use the reviewed examples as a contrastive calibration set; retain source language and uncertainty notes."
    },
    {
      "case_id": "lincoln",
      "categories": [
        "domain-instability"
      ],
      "decided_at": null,
      "decision_rationale": "Awaiting explicit human review.",
      "decision_source": "generated-default",
      "disagreement_ids": [
        "disagreement-0004",
        "disagreement-0027",
        "disagreement-0050",
        "disagreement-0072",
        "disagreement-0095",
        "disagreement-0118",
        "disagreement-0141"
      ],
      "disposition": "deferred",
      "evidence_count": 7,
      "field": "cmt.source_domain_primary",
      "finding_type": "ambiguous-instruction",
      "observation": "7 queued `domain-instability` item(s) affect `cmt.source_domain_primary` in `en`.",
      "queue_ids": [
        "review-0034",
        "review-0041",
        "review-0048",
        "review-0099",
        "review-0106",
        "review-0113",
        "review-0120"
      ],
      "recommendation_id": "codebook-rec-7c2926693152",
      "recommended_change": "Clarify domain and cluster distinctions with contrastive mapping examples.",
      "reviewer": null,
      "source_language": "en",
      "task_layer": "cmt",
      "training_use": "Use the reviewed examples as a contrastive calibration set; retain source language and uncertainty notes."
    },
    {
      "case_id": "lincoln",
      "categories": [
        "domain-instability"
      ],
      "decided_at": null,
      "decision_rationale": "Awaiting explicit human review.",
      "decision_source": "generated-default",
      "disagreement_ids": [
        "disagreement-0005",
        "disagreement-0028",
        "disagreement-0051",
        "disagreement-0073",
        "disagreement-0096",
        "disagreement-0119",
        "disagreement-0142"
      ],
      "disposition": "deferred",
      "evidence_count": 7,
      "field": "cmt.source_domain_secondary",
      "finding_type": "ambiguous-instruction",
      "observation": "7 queued `domain-instability` item(s) affect `cmt.source_domain_secondary` in `en`.",
      "queue_ids": [
        "review-0035",
        "review-0042",
        "review-0049",
        "review-0100",
        "review-0107",
        "review-0114",
        "review-0121"
      ],
      "recommendation_id": "codebook-rec-8efcb632c3ca",
      "recommended_change": "Clarify domain and cluster distinctions with contrastive mapping examples.",
      "reviewer": null,
      "source_language": "en",
      "task_layer": "cmt",
      "training_use": "Use the reviewed examples as a contrastive calibration set; retain source language and uncertainty notes."
    },
    {
      "case_id": "lincoln",
      "categories": [
        "target-domain-instability"
      ],
      "decided_at": null,
      "decision_rationale": "Awaiting explicit human review.",
      "decision_source": "generated-default",
      "disagreement_ids": [
        "disagreement-0006",
        "disagreement-0029",
        "disagreement-0052",
        "disagreement-0074",
        "disagreement-0097",
        "disagreement-0120",
        "disagreement-0143"
      ],
      "disposition": "deferred",
      "evidence_count": 7,
      "field": "cmt.target_domain",
      "finding_type": "ambiguous-instruction",
      "observation": "7 queued `target-domain-instability` item(s) affect `cmt.target_domain` in `en`.",
      "queue_ids": [
        "review-0036",
        "review-0043",
        "review-0050",
        "review-0101",
        "review-0108",
        "review-0115",
        "review-0122"
      ],
      "recommendation_id": "codebook-rec-ce1e63f5bbd8",
      "recommended_change": "Clarify domain and cluster distinctions with contrastive mapping examples.",
      "reviewer": null,
      "source_language": "en",
      "task_layer": "cmt",
      "training_use": "Use the reviewed examples as a contrastive calibration set; retain source language and uncertainty notes."
    },
    {
      "case_id": "lincoln",
      "categories": [
        "confidence-instability"
      ],
      "decided_at": null,
      "decision_rationale": "Awaiting explicit human review.",
      "decision_source": "generated-default",
      "disagreement_ids": [
        "disagreement-0007",
        "disagreement-0030",
        "disagreement-0053",
        "disagreement-0075",
        "disagreement-0098",
        "disagreement-0121",
        "disagreement-0144"
      ],
      "disposition": "deferred",
      "evidence_count": 7,
      "field": "confidence",
      "finding_type": "ambiguous-instruction",
      "observation": "7 queued `confidence-instability` item(s) affect `confidence` in `en`.",
      "queue_ids": [
        "review-0154",
        "review-0155",
        "review-0156",
        "review-0157",
        "review-0158",
        "review-0159",
        "review-0160"
      ],
      "recommendation_id": "codebook-rec-39e5d178f21b",
      "recommended_change": "Add confidence anchors and examples for adjacent confidence levels.",
      "reviewer": null,
      "source_language": "en",
      "task_layer": "cmt",
      "training_use": "Use the reviewed examples as a contrastive calibration set; retain source language and uncertainty notes."
    },
    {
      "case_id": "lincoln",
      "categories": [
        "context-instability"
      ],
      "decided_at": null,
      "decision_rationale": "Awaiting explicit human review.",
      "decision_source": "generated-default",
      "disagreement_ids": [
        "disagreement-0023",
        "disagreement-0046",
        "disagreement-0091",
        "disagreement-0114",
        "disagreement-0137",
        "disagreement-0160"
      ],
      "disposition": "deferred",
      "evidence_count": 6,
      "field": "uncertainty.status",
      "finding_type": "ambiguous-instruction",